{
  "exact_reviews": [
    {
      "authoritative_location": "",
      "decision": "keep",
      "evidence": {
        "locations": [
          {
            "block_index": "1",
            "path": "references/integration/configuration.md",
            "preview": "## Table of Contents"
          },
          {
            "block_index": "1",
            "path": "references/integration/host-integration.md",
            "preview": "## Table of Contents"
          },
          {
            "block_index": "1",
            "path": "references/rules/erie-style.md",
            "preview": "## Table of Contents"
          },
          {
            "block_index": "1",
            "path": "references/workflows/workflow-contracts.md",
            "preview": "## Table of Contents"
          }
        ],
        "sha256": "8f69bcfd17f83a1341b4065d1d216e505044e8d06d131085b9aa1fb2dcebb94d"
      },
      "id": "exact.8f69bcfd17f83a13",
      "rationale": "Table of Contents 是各自权威文档的结构导航，不复制合同正文，跨文档合并会破坏局部可读性。"
    },
    {
      "authoritative_location": "",
      "decision": "keep",
      "evidence": {
        "locations": [
          {
            "block_index": "7",
            "path": "references/rules/verilog-code-comment-naming-standard.md",
            "preview": "---"
          },
          {
            "block_index": "10",
            "path": "references/rules/verilog-code-comment-naming-standard.md",
            "preview": "---"
          },
          {
            "block_index": "18",
            "path": "references/rules/verilog-code-comment-naming-standard.md",
            "preview": "---"
          },
          {
            "block_index": "27",
            "path": "references/rules/verilog-code-comment-naming-standard.md",
            "preview": "---"
          },
          {
            "block_index": "41",
            "path": "references/rules/verilog-code-comment-naming-standard.md",
            "preview": "---"
          },
          {
            "block_index": "64",
            "path": "references/rules/verilog-code-comment-naming-standard.md",
            "preview": "---"
          },
          {
            "block_index": "94",
            "path": "references/rules/verilog-code-comment-naming-standard.md",
            "preview": "---"
          },
          {
            "block_index": "108",
            "path": "references/rules/verilog-code-comment-naming-standard.md",
            "preview": "---"
          },
          {
            "block_index": "122",
            "path": "references/rules/verilog-code-comment-naming-standard.md",
            "preview": "---"
          },
          {
            "block_index": "130",
            "path": "references/rules/verilog-code-comment-naming-standard.md",
            "preview": "---"
          },
          {
            "block_index": "143",
            "path": "references/rules/verilog-code-comment-naming-standard.md",
            "preview": "---"
          },
          {
            "block_index": "153",
            "path": "references/rules/verilog-code-comment-naming-standard.md",
            "preview": "---"
          },
          {
            "block_index": "165",
            "path": "references/rules/verilog-code-comment-naming-standard.md",
            "preview": "---"
          },
          {
            "block_index": "189",
            "path": "references/rules/verilog-code-comment-naming-standard.md",
            "preview": "---"
          },
          {
            "block_index": "192",
            "path": "references/rules/verilog-code-comment-naming-standard.md",
            "preview": "---"
          },
          {
            "block_index": "203",
            "path": "references/rules/verilog-code-comment-naming-standard.md",
            "preview": "---"
          },
          {
            "block_index": "206",
            "path": "references/rules/verilog-code-comment-naming-standard.md",
            "preview": "---"
          },
          {
            "block_index": "210",
            "path": "references/rules/verilog-code-comment-naming-standard.md",
            "preview": "---"
          },
          {
            "block_index": "222",
            "path": "references/rules/verilog-code-comment-naming-standard.md",
            "preview": "---"
          }
        ],
        "sha256": "cb3f91d54eee30e53e35b2b99905f70f169ed549fd78909d3dac2defc9ed8d3b"
      },
      "id": "exact.cb3f91d54eee30e5",
      "rationale": "分隔线用于单一长规则书的章节结构与阅读定位，不承载可独立合并的知识语义。"
    }
  ],
  "fuzzy_reviews": [],
  "interface_reviews": [
    {
      "command_ids": [
        "toolchain.dependencies-install"
      ],
      "decision": "mapped",
      "kind": "option",
      "rationale": "",
      "sources": [
        "references/integration/configuration.md"
      ],
      "value": "--allow-fpga-agent-fallback"
    },
    {
      "command_ids": [
        "registry.ask"
      ],
      "decision": "mapped",
      "kind": "option",
      "rationale": "",
      "sources": [
        "SKILL.md"
      ],
      "value": "--category"
    },
    {
      "command_ids": [
        "remote.validate"
      ],
      "decision": "mapped",
      "kind": "option",
      "rationale": "",
      "sources": [
        "references/integration/configuration.md"
      ],
      "value": "--cleanup-remote"
    },
    {
      "command_ids": [
        "registry.document-governance"
      ],
      "decision": "mapped",
      "kind": "option",
      "rationale": "",
      "sources": [
        "references/skill/script-guide.md"
      ],
      "value": "--confirm-user"
    },
    {
      "command_ids": [
        "toolchain.dependencies-install"
      ],
      "decision": "mapped",
      "kind": "option",
      "rationale": "",
      "sources": [
        "references/integration/configuration.md"
      ],
      "value": "--dependency-id"
    },
    {
      "command_ids": [
        "registry.document-governance"
      ],
      "decision": "mapped",
      "kind": "option",
      "rationale": "",
      "sources": [
        "references/skill/script-guide.md"
      ],
      "value": "--enable"
    },
    {
      "command_ids": [
        "workflow.evaluate"
      ],
      "decision": "mapped",
      "kind": "option",
      "rationale": "",
      "sources": [
        "references/integration/configuration.md"
      ],
      "value": "--evals"
    },
    {
      "command_ids": [],
      "decision": "not_public",
      "kind": "option",
      "rationale": "该选项属于 erie-remote-ssh 的 run-request 外部调用，不是本技能 remote_validate_verilog_skill 的公开参数。",
      "sources": [
        "references/integration/configuration.md"
      ],
      "value": "--execute"
    },
    {
      "command_ids": [
        "validation.generated-deliverable",
        "quality.verilog"
      ],
      "decision": "mapped",
      "kind": "option",
      "rationale": "外部接口源只补充 VG097 静态接口事实，不替代目标 RTL 或外部工具证据。",
      "sources": [
        "SKILL.md",
        "references/skill/script-guide.md"
      ],
      "value": "--external-interface-source"
    },
    {
      "command_ids": [
        "registry.ask",
        "registry.document-governance",
        "validation.generated-deliverable",
        "quality.verilog"
      ],
      "decision": "mapped",
      "kind": "option",
      "rationale": "",
      "sources": [
        "SKILL.md",
        "references/rules/verilog-code-comment-naming-standard.md",
        "references/skill/script-guide.md"
      ],
      "value": "--json"
    },
    {
      "command_ids": [
        "remote.validate"
      ],
      "decision": "mapped",
      "kind": "option",
      "rationale": "",
      "sources": [
        "references/integration/configuration.md"
      ],
      "value": "--keep-remote"
    },
    {
      "command_ids": [
        "registry.ask"
      ],
      "decision": "mapped",
      "kind": "option",
      "rationale": "",
      "sources": [
        "SKILL.md"
      ],
      "value": "--kind"
    },
    {
      "command_ids": [
        "registry.ask"
      ],
      "decision": "mapped",
      "kind": "option",
      "rationale": "",
      "sources": [
        "SKILL.md"
      ],
      "value": "--limit"
    },
    {
      "command_ids": [
        "external.verilator-lint"
      ],
      "decision": "mapped",
      "kind": "option",
      "rationale": "",
      "sources": [
        "references/checklists/lint-checklist.md"
      ],
      "value": "--lint-only"
    },
    {
      "command_ids": [
        "quality.external-interface-manifest"
      ],
      "decision": "mapped",
      "kind": "option",
      "rationale": "manifest 只由项目 IP 接口渲染子命令读取。",
      "sources": [
        "references/skill/script-guide.md"
      ],
      "value": "--manifest"
    },
    {
      "command_ids": [
        "validation.generated-deliverable",
        "quality.verilog"
      ],
      "decision": "mapped",
      "kind": "option",
      "rationale": "",
      "sources": [
        "SKILL.md",
        "references/rules/verilog-code-comment-naming-standard.md"
      ],
      "value": "--markdown"
    },
    {
      "command_ids": [
        "workflow.run",
        "workflow.batch"
      ],
      "decision": "mapped",
      "kind": "option",
      "rationale": "command provider 必须通过该选项取得显式外部命令，缺失时 fail closed。",
      "sources": [
        "references/workflows/workflow-contracts.md"
      ],
      "value": "--model-command"
    },
    {
      "command_ids": [
        "workflow.run",
        "workflow.batch"
      ],
      "decision": "mapped",
      "kind": "option",
      "rationale": "两个生成入口共享 mock、manual、command provider 选择合同。",
      "sources": [
        "references/workflows/workflow-contracts.md"
      ],
      "value": "--model-provider"
    },
    {
      "command_ids": [
        "workflow.run",
        "workflow.batch"
      ],
      "decision": "mapped",
      "kind": "option",
      "rationale": "该超时限制 command provider 的单次外部调用。",
      "sources": [
        "references/workflows/workflow-contracts.md"
      ],